{
  "schema": "kinetic/gym/prebuild-review@0.1",
  "review_id": "pbr-v2-20260901-062123",
  "case_id": "case-ee9eaf0dc9",
  "variant_id": "V2",
  "brief_sha256": "6644ea477865254d760b31ee606f14ef26af63d05ed6cb043fbbe50c54892e51",
  "retrieval_sha256": "91b1bcb4453a59ca3220b686918816280758ad24e5f82090da5055d300a7ebca",
  "decision": "APPROVED",
  "rule_results": [
    {
      "rule_id": "PB01_GENERIC_HERO_CARDS",
      "passed": true,
      "evidence_path": "$.composition_plan",
      "reason": "timecode slate, horizontal transmission bands and night-desk close define an authored composition beyond generic hero/cards/footer"
    },
    {
      "rule_id": "PB02_DEFAULT_TYPOGRAPHY",
      "passed": true,
      "evidence_path": "$.typography_plan",
      "reason": "clipped broadcast phrases, timecode numerals and quiet serif annotations establish a deliberate role system"
    },
    {
      "rule_id": "PB03_NO_ASSET_STRATEGY",
      "passed": true,
      "evidence_path": "$.art_direction.asset_strategy",
      "reason": "CSS-only signal fields and explicit non-reuse plan cover all visual material"
    },
    {
      "rule_id": "PB04_NO_SIGNATURE_MOVE",
      "passed": true,
      "evidence_path": "$.motion_plan.signature_move",
      "reason": "afterimage trace is a named, substantive interaction that resolves the active transmission"
    },
    {
      "rule_id": "PB05_DECORATIVE_ONLY_MOTION",
      "passed": true,
      "evidence_path": "$.motion_plan.signature_move",
      "reason": "trace and coral bracket are tied to the active transmission title/timecode and have a reduced-motion state"
    },
    {
      "rule_id": "PB06_NO_TRANSITION_STORYBOARD",
      "passed": true,
      "evidence_path": "$.motion_plan.scroll_storyboard",
      "reason": "broadcast storyboard, transitions and interaction states are explicit"
    },
    {
      "rule_id": "PB07_NO_DEPTH_DECISION",
      "passed": true,
      "evidence_path": "$.art_direction.depth",
      "reason": "offset signal layers, clipped bands and inset borders define depth without an unbounded effect"
    },
    {
      "rule_id": "PB08_WEAK_NARRATIVE",
      "passed": true,
      "evidence_path": "$.core_concept",
      "reason": "late-night signal-room concept, frequency order and transmission focal points form an authored narrative"
    },
    {
      "rule_id": "PB09_INSUFFICIENT_SOURCE_GROUNDING",
      "passed": true,
      "evidence_path": "$.source_provenance",
      "reason": "DesignCase and audited principle sources are explicitly attributed and retrievable"
    },
    {
      "rule_id": "PB10_DERIVATIVE_COMPOSITION",
      "passed": true,
      "evidence_path": "$.originality_plan",
      "reason": "timecode rail, horizontal bands and broadcast index provide substantive composition differences from V0 and V1"
    },
    {
      "rule_id": "PB11_COMPONENT_SOUP",
      "passed": true,
      "evidence_path": "$.source_provenance.implementation_sources",
      "reason": "no implementation influences are claimed and the brief keeps one coherent visual system"
    },
    {
      "rule_id": "PB12_RIGHTS_MISMATCH",
      "passed": true,
      "evidence_path": "$.source_provenance",
      "reason": "all influential sources resolve through the current rights-authorized registry"
    },
    {
      "rule_id": "PB13_WEAK_QUALITY_HYPOTHESIS",
      "passed": true,
      "evidence_path": "$.quality_hypothesis",
      "reason": "hypothesis names the preserved grammar and the V0/V1/V2 distinction that review can test"
    },
    {
      "rule_id": "PB14_SOURCE_ORDER_VIOLATION",
      "passed": true,
      "evidence_path": "$.source_provenance.implementation_sources",
      "reason": "reference principles and original direction precede any implementation dependency"
    },
    {
      "rule_id": "PB15_ORIGINALS_BEFORE_V0",
      "passed": true,
      "evidence_path": "$.reference_transfer",
      "reason": "human-approved V0 FidelityReport is recorded before this original slot proceeds"
    }
  ],
  "advisory_observations": [],
  "blocking_reasons": [],
  "reviewer": "kinetic/prebuild-review@0.1",
  "created_at": "2026-09-01T06:21:23Z"
}