{
  "schema": "kinetic/gym/prebuild-review@0.1",
  "review_id": "pbr-c83b23fe0f150705e605",
  "case_id": "case-ee9eaf0dc9",
  "variant_id": "V0",
  "brief_sha256": "5e33a9427f087ad712bf5cef870b84e6cfbb85e2d6c2292017a73f8f395cae12",
  "retrieval_sha256": "8858dc896edd5d577819ba8146e5d0afb07c00fdbb3b9dd2c2566592a9862042",
  "decision": "APPROVED",
  "rule_results": [
    {
      "rule_id": "PB01_GENERIC_HERO_CARDS",
      "passed": true,
      "evidence_path": "$.composition_plan",
      "reason": "sections require an authored spatial or narrative concept beyond generic hero/cards/footer"
    },
    {
      "rule_id": "PB02_DEFAULT_TYPOGRAPHY",
      "passed": true,
      "evidence_path": "$.typography_plan",
      "reason": "typography roles and strategies must not all be defaults"
    },
    {
      "rule_id": "PB03_NO_ASSET_STRATEGY",
      "passed": true,
      "evidence_path": "$.art_direction.asset_strategy",
      "reason": "imagery and asset strategy must be explicit"
    },
    {
      "rule_id": "PB04_NO_SIGNATURE_MOVE",
      "passed": true,
      "evidence_path": "$.motion_plan.signature_move",
      "reason": "V0 is exempt from originality signature requirements"
    },
    {
      "rule_id": "PB05_DECORATIVE_ONLY_MOTION",
      "passed": true,
      "evidence_path": "$.motion_plan.signature_move",
      "reason": "V0 is exempt from originality motion requirements"
    },
    {
      "rule_id": "PB06_NO_TRANSITION_STORYBOARD",
      "passed": true,
      "evidence_path": "$.motion_plan.scroll_storyboard",
      "reason": "scroll storyboard and transitions must be explicit"
    },
    {
      "rule_id": "PB07_NO_DEPTH_DECISION",
      "passed": true,
      "evidence_path": "$.art_direction.depth",
      "reason": "depth and layering decisions must be explicit"
    },
    {
      "rule_id": "PB08_WEAK_NARRATIVE",
      "passed": true,
      "evidence_path": "$.core_concept",
      "reason": "core concept, hierarchy, and focal points must form an authored narrative"
    },
    {
      "rule_id": "PB09_INSUFFICIENT_SOURCE_GROUNDING",
      "passed": true,
      "evidence_path": "$.source_provenance",
      "reason": "brief DesignCases and influential sources must match retrieval provenance with attribution"
    },
    {
      "rule_id": "PB10_DERIVATIVE_COMPOSITION",
      "passed": true,
      "evidence_path": "$.originality_plan",
      "reason": "V0 fidelity study is exempt from originality differences"
    },
    {
      "rule_id": "PB11_COMPONENT_SOUP",
      "passed": true,
      "evidence_path": "$.source_provenance.implementation_sources",
      "reason": "at most two implementation influences and one catalogue build dependency are allowed"
    },
    {
      "rule_id": "PB12_RIGHTS_MISMATCH",
      "passed": true,
      "evidence_path": "$.source_provenance",
      "reason": "every influential source must be present and rights-authorized in the retrieval receipt"
    },
    {
      "rule_id": "PB13_WEAK_QUALITY_HYPOTHESIS",
      "passed": true,
      "evidence_path": "$.quality_hypothesis",
      "reason": "quality hypothesis must be substantive and testable"
    },
    {
      "rule_id": "PB14_SOURCE_ORDER_VIOLATION",
      "passed": true,
      "evidence_path": "$.source_provenance.implementation_sources",
      "reason": "concept and retained principles must precede implementation influences"
    },
    {
      "rule_id": "PB15_ORIGINALS_BEFORE_V0",
      "passed": true,
      "evidence_path": "$.fidelity_report.human_approval",
      "reason": "V0 is the required first study"
    }
  ],
  "advisory_observations": [],
  "blocking_reasons": [],
  "reviewer": "kinetic/prebuild-review@0.1",
  "created_at": "2026-08-27T12:36:05.490Z"
}